date,text,image_id
"2021-05-14","Вот отличная пословица «В родном доме и стены помогают». Она означает, что родной дом защищает человека и даёт ему силы и энергию. И пароль от вай-фая не надо спрашивать.","1030494/061a675d22f565a30214"
"2021-05-15","Отличный пример русской пословицы: «Где нельзя перескочить, там можно перелезть». Она означает, что всегда есть выход, только надо немного подумать. Но только головой!","1030494/061a675d22f565a30214"
"2021-05-16","Очень актуальная пословица: «Делу время, а потехе час». Она про то, что приоритет надо отдавать работе, но и не забывать об отдыхе. Эх, сейчас бы незабываемый отдых, а не вот это всё.","1030494/061a675d22f565a30214"
"2021-05-17","«Если долго мучиться, что-нибудь получится». Она говорит о том, что упорный труд всегда приводит к результату. Но не всегда этот результат стоит потраченных на него усилий.","1030494/061a675d22f565a30214"
"2021-05-18","Вот пословица: «И швец, и жнец, и в дуду игрец». Так говорят о мастере, который качественно делает любую работу. Вот какой он молодец!","1030494/061a675d22f565a30214"
"2021-05-19","«Кому до чего, а кузнецу до наковальни». Так говорят о людях, которые на всё смотрят со своей точки зрения. Кстати, не забудьте оплатить интернет!","1030494/061a675d22f565a30214"
"2021-05-20","Пословица из трёх слов: «Краткость — сестра таланта». Это о том, что всё гениальное просто. Тоже три слова, кстати.","1030494/061a675d22f565a30214"
"2021-05-21","«На брюхе шёлк, а в брюхе щёлк». Так говорят о бедном человеке, который потратил последние деньги на дорогую одежду. Или на последний айфон.","1030494/061a675d22f565a30214"
"2021-05-22","Когда говорят, что гора родила мышь, это значит, что сил затрачено много, а результат ничтожный.","1030494/061a675d22f565a30214"
"2021-05-23","Есть такая поговорка «С лица воды не пить». Это значит, что настоящая красота — в поступках человека, а не во внешности.","1030494/061a675d22f565a30214"
"2021-05-24","«Дела идут, контора пишет» — говорят о деле, на которое не влияет никакие обстоятельства.","1030494/061a675d22f565a30214"
"2021-05-25","Поговорка «Молчание — знак согласия» означает, что если вы ничего не сказали, значит, согласны с утверждением.","1030494/061a675d22f565a30214"
"2021-05-26","Когда говорят, что дома помогают стены, это значит, что в знакомой обстановке мы чувствуем себя спокойнее и увереннее и можем справиться с любым делом.","1030494/061a675d22f565a30214"
"2021-05-27","После драки кулаками не машут. Так говорят, что если беда уже случилась, поздно что-то менять.","1030494/061a675d22f565a30214"
"2021-05-28","Открыть Америку — означает объявить о том, что всем давно известно.","1030494/061a675d22f565a30214"
"2021-05-29","«Изобретать велосипед» — тратить время на выдумывание того, что давно существует.","1030494/061a675d22f565a30214"
"2021-05-30","Ошибиться может каждый, даже очень умный человек. Это подтверждает поговорка «И на старуху бывает проруху».","1030494/061a675d22f565a30214"
"2021-05-31","Если ваш собеседник скажет «Жить прожить — не поле перейти», знайте, что он говорит о превратностях судьбы и жизненных сложностях.","1030494/061a675d22f565a30214"
"2021-06-01","Дружба дружбой, а служба службой. Эта поговорка означает, что не должны дружеские отношения между людьми влиять на рабочие.","1030494/061a675d22f565a30214"
"2021-06-02","Говорят, что «Бумага всё стерпит». Это значит, что написать можно что угодно, но обмануть людей не так просто.","1030494/061a675d22f565a30214"
"2021-06-03","Если пострадавшему говорят «До свадьбы заживёт», это значит, что скоро все будет хорошо, всё заживёт и пройдёт.","1030494/061a675d22f565a30214"
"2021-06-04","Вот вам пословица «Не по Сеньке шапка». Она означает, что человек, о котором говорят, не может выполнить работу.","1030494/061a675d22f565a30214"
"2021-06-05","Как невозможно «найти ветер в поле», так и невозможно отыскать то, что безвозвратно утрачено.","1030494/061a675d22f565a30214"
"2021-06-06","Ничего не происходит без причины. Как раз об этом поговорка «Нет дыма без огня».","1030494/061a675d22f565a30214"
"2021-06-07","О подражании плохому поведению других людей даже есть поговорка «Дурной пример заразительный».","1030494/061a675d22f565a30214"
"2021-06-08","Когда говорят «за что купил, за что продаю», имеют в виду, что не ручаются за достоверность истории или новости.","1030494/061a675d22f565a30214"
"2021-06-09","Смысл пословицы «Апрель с водой — май с травой» в том, что если весной будет много дождей, то растения будут расти очень хорошо.","1030494/061a675d22f565a30214"
"2021-06-10","Бывает, когда мы решаем, бывает, когда решают за нас и без нас. Второй случай иллюстрирует поговорку «Без меня меня женили».","1030494/061a675d22f565a30214"
"2021-06-11","Когда говорят, что дорога ложка к обеду, это значит, что вещь, событие или действие важны в определённый момент.","1030494/061a675d22f565a30214"
"2021-06-12","Поговорка «Не все сосны в лесу корабельные» рассказывает о том, что не всё в жизни плохое или хорошее. Бывает и то и другое.","1030494/061a675d22f565a30214"
"2021-06-13","Когда о человеке говорят, что он и курицу не обидит, это означает, что он очень добрый малый, неспособный сделать кому-то больно.","1030494/061a675d22f565a30214"
"2021-06-14","Кажется, что поговорка «Хвалилась синица море зажечь» о жизни животных, но это не так. Эта поговорка о человеке, который постоянно хвастается, но ничего не делает.","1030494/061a675d22f565a30214"
"2021-06-15","Во всём нужно знать меру. Именно об этом поговорка «Через силу и конь не скачет».","1030494/061a675d22f565a30214"
"2021-06-16","Русская пословица «Была пора, да минулась» означает, что каждому делу или событию своё время. Пока есть возможность, нужно ей пользоваться.","1030494/061a675d22f565a30214"
"2021-06-17","В кулаке все пальцы равны. Так говорят о сплочённом коллективе.","1030494/061a675d22f565a30214"
"2021-06-18","Случай, когда человеку не интересно то, о чём говорят сейчас, описывает поговорка «В одно ухо влетело, в другое вылетело».","1030494/061a675d22f565a30214"
"2021-06-19","«И в ус не дует» — так говорят о человеке, который ни о чём не беспокоится.","1030494/061a675d22f565a30214"
"2021-06-20","Поговорка «Как умею, так и брею» о том, что о человеке, который делает своё дело не очень хорошо.","1030494/061a675d22f565a30214"
