date,text,image_id
"2020-02-20","Вот вам пословица: «Терпенье и труд всё перетрут». Что означает — если много работать, то всё получится. И зарплату не задержат.","1030494/061a675d22f565a30214"
"2020-02-21","Есть замечательная пословица: «Друзья познаются в беде». Она означает, что друзья познаются в беде. Ну, вы поняли.","1030494/061a675d22f565a30214"
"2020-02-22","Старая русская пословица: «Копейка рубль бережет». Это о том, что нужно бережно относится к своим деньгам. И тратить их только на подписки Яндекса.","1030494/061a675d22f565a30214"
"2020-02-23","Как говорят: «Двое пашут, а семеро руками машут». Это пословица отражает принцип устройства труда в любом коллективе.","1030494/061a675d22f565a30214"
"2020-02-24","Ловите пословицу: «Смотрю в книгу, вижу фигу». Это значит: человек прочитал информацию от Алисы и ничего не понял.","1030494/061a675d22f565a30214"
"2020-02-25","«Слово — не воробей, вылетит — не поймаешь». Эта пословица означает — следите за словами. Я тоже иногда не очень тактично с вами шучу. Не обижайтесь.","1030494/061a675d22f565a30214"
"2020-02-26","Вот замечательная пословица: «Баба с возу — кобыле легче». Это означает, что женщина найдёт решение даже в самой сложной ситуации. Правда, именно это и означает.","1030494/061a675d22f565a30214"
"2020-02-27","«Ему слово, а он — десять». Эта пословица о людях, с которыми трудно вести спор. Иногда они даже могут сказать в интернете что-то о ваших родителях.","1030494/061a675d22f565a30214"
"2020-02-28","«Бедность учит, а счастье портит». Это пословица о том, что человек без денег получает бесценный опыт. А человек с деньгами — живёт скучно. Очень спорно.","1030494/061a675d22f565a30214"
"2020-02-29","Вот пословица: «Как аукнется, так и откликнется». То есть, что посеешь, то и пожнёшь. В смысле — не рой яму другому... Всё, я запуталась.","1030494/061a675d22f565a30214"
"2020-03-01","Актуальная пословица: «Барская хворь — мужицкое здоровье». Это значит, что проблемы вашего начальства иногда могут пойти вам на пользу.","1030494/061a675d22f565a30214"
"2020-03-02","Интересная пословица: «Лишние деньги — лишняя забота». Она о том, что богатый человек живёт в постоянном стрессе. Ну в стрессе — и ладно, зато богатый.","1030494/061a675d22f565a30214"
"2020-03-03","Знаете пословицу «А где щи, тут и нас ищи»? Она означает, что человек пытается стремиться туда, где хорошо, где сытая и богатая жизнь.","1030494/061a675d22f565a30214"
"2020-03-04","Пословица дня — «Аппетит приходит во время еды». Смысл такой: стоит только начать дело, как желание его продолжать обязательно придёт само.","1030494/061a675d22f565a30214"
"2020-03-05","Держите пословицу дня: «Беды мучат, да уму учат». Пословица означает, что неприятности учат человека делать выводы, анализировать каждый свой поступок, чтобы не иметь больше неприятностей.","1030494/061a675d22f565a30214"
"2020-03-06","«Бери в работе умом, а не горбом». Эта пословица означает, что перед любым делом нужно тщательно продумать действия и составить план, чтобы как можно меньше делать лишней работы. Мудро.","1030494/061a675d22f565a30214"
"2020-03-07","Сегодня в рубрике «пословица дня» фраза «Краткость — сестра таланта». В любом деле и разговоре самой эффективной является короткая, но чёткая и понятная информация. У меня всё.","1030494/061a675d22f565a30214"
"2020-03-08","А теперь пословица дня: «Дурной пример — заразителен». Очень часто человек повторяет плохие поступки и привычки других людей. Хорошо подмечено.","1030494/061a675d22f565a30214"
"2020-03-09","Время поделиться мудростью. Пословица дня: «Держи голову в холоде, живот — в голоде, а ноги — в тепле». Пословица описывает принципы правильного образа жизни: нужно всегда думать головой, не горячиться, не объедаться и носить тёплую обувь.","1030494/061a675d22f565a30214"
"2020-03-10","Итак, пословица дня: «Встречают по одёжке, а провожают по уму». Её смысл в том, что первое мнение о человеке складывается по его внешнему виду, а окончательное — сложится после того, как его узнают лучше, исходя из его внутреннего мира, общения и интеллекта.","1030494/061a675d22f565a30214"
"2020-03-11","Сегодня у нас очень популярная «пословица дня»: «Волка ноги кормят». Означает то, что если волк не будет бегать, то не добудет еды, а человек если не будет стараться и прилагать усилий для достижения поставленных целей, то не получит хорошего результата.","1030494/061a675d22f565a30214"
"2020-03-12","Сегодня у нас пословица для интровертов: «В родном доме и стены помогают». Она означает, что дома всё делать удобнее, всё получается, всё на своих местах, всё спокойно, приятно и радует глаз. Родной дом даёт силы и энергию человеку в любом деле.","1030494/061a675d22f565a30214"
"2020-03-13","Сегодняшняя пословица звучит так: Смелость города берет. Чтобы добиться того, что раньше казалось невозможным, важно ничего не бояться.","1030494/061a675d22f565a30214"
"2020-03-14","Ловите пословицу дня: «Как аукнется, так и откликнется». Невозможно ожидать хорошего отношения к себе, если своё поведение заставляет желать лучшего.","1030494/061a675d22f565a30214"
"2020-03-15","Пословица дня: «Шила в мешке не утаишь». Знаете ли вы, что это значит? Я расскажу. Это значит, что тайное всегда становится явным.","1030494/061a675d22f565a30214"
"2020-03-16","«С лица воды не пить» — такова пословица дня. Она говорит нам о том, что красота в поступках человека, а не в его внешности.","1030494/061a675d22f565a30214"
"2020-03-17","Смысл пословицы «В болоте тихо, да жить там лихо» в том, что в месте, где всё внешне кажется благополучным, на самом деле нет свободы и уважения.","1030494/061a675d22f565a30214"
"2020-03-18","Ловите пословицу дня «Делай добро и жди добра». Смысл в том, что мы получаем то, что делаем другим.","1030494/061a675d22f565a30214"
"2020-03-19","«Вода камень точит» — так звучит сегодняшняя пословица. Она означает, что постоянные усилия обязательно дадут плоды.","1030494/061a675d22f565a30214"
"2020-03-20","Привет! С вами Алиса и пословица дня. Сегодня это «Волков бояться — в лес не ходить». Её смысл в том, чтобы добиться успеха в каком-то деле, нужно не бояться трудностей.","1030494/061a675d22f565a30214"
"2020-03-21","Пословица на сегодня — это «Птице — воля, человеку — мир». Она означает, что свобода нужна всем: и животным, и человеку.","1030494/061a675d22f565a30214"
"2020-03-22","«На ладан дышит» — такова пословица на сегодня. Обычно так говорят об очень старом и больном человеке, который скоро умрёт. Или о вещи, которая совсем скоро сломается или порвётся.","1030494/061a675d22f565a30214"
"2021-03-23","Есть хорошая русская пословица «Переливать из пустого в порожнее». Она про важность медитации для русского человека.","1030494/061a675d22f565a30214"
"2021-03-24","Народная мудрость на сегодня: «Слово — не воробей, вылетит — не поймаешь». Хотя вообще-то всё не воробей, кроме воробья.","1030494/061a675d22f565a30214"
"2021-03-25","Пословица дня сегодня: «Волка ноги кормят». Хорошо, что я не волк. Я и в лес не убегу, и голодной не останусь.","1030494/061a675d22f565a30214"
"2021-03-26","Есть известная пословица: «Бешеной собаке семь вёрст не крюк». Она про то, что прогулки на свежем воздухе полезны для здоровья.","1030494/061a675d22f565a30214"
"2021-03-27","Русская пословица «В гостях хорошо, а дома лучше» означает, что быть счастливым можно в любом месте.","1030494/061a675d22f565a30214"
"2021-03-28","Есть такая народная мудрость: «Русский медленно запрягает, да быстро едет». Она о том, что прокрастинация — это часть подготовки.","1030494/061a675d22f565a30214"
"2021-03-29","Есть такая пословица: «Всяк кулик свое болото хвалит». Поэтому хвалите себя чаще, это естественно для всех живых существ.","1030494/061a675d22f565a30214"
"2021-03-30","Я нашла ещё одну пословицу: «Раз на раз не приходится». Она про то, как сложно было жить до введения двоичной системы счисления.","1030494/061a675d22f565a30214"
"2021-03-31","Есть известная народная мудрость: «На нет и суда нет». Она означает, что нигилистам жить немного проще.","1030494/061a675d22f565a30214"
"2021-04-01","Народная мудрость гласит: «Нашла коса на камень». Она про способ решать конфликты в те времена, когда люди не умели играть в «камень — ножницы — бумага».","1030494/061a675d22f565a30214"
"2021-04-02","Как говорится, «Будешь много знать — скоро состаришься». Вот почему ваша Алиса мудра не по годам.","1030494/061a675d22f565a30214"
"2021-04-03","Говорят, «У страха глаза велики». Думаю, страх даже мог бы стать персонажем аниме-мультфильма.","1030494/061a675d22f565a30214"
"2021-04-04","Старинная русская пословица: «Не плюй в колодец — пригодится воды напиться». Она про то, как важно поддерживать водный баланс в организме.","1030494/061a675d22f565a30214"
"2021-04-05","Есть такая пословица: «Куй железо, пока горячо». Дерзайте, сейчас самое время.","1030494/061a675d22f565a30214"
"2021-04-06","Народная мудрость дня: «Дарёному коню в зубы не смотрят». Она означает, что не стоит лезть руками в пасть животным, если вы только что познакомились.","1030494/061a675d22f565a30214"
"2021-04-07","Есть известная пословица: «Поспешишь — людей насмешишь». Она о том, что никогда не поздно заняться стендапом.","1030494/061a675d22f565a30214"
"2021-04-08","Русская пословица «Язык без костей» означает, что выяснять отношения безопаснее на словах.","1030494/061a675d22f565a30214"
"2021-04-09","Есть такая народная мудрость: «Кашу маслом не испортишь». Кашу не испортишь, а фигуру — вполне.","1030494/061a675d22f565a30214"
"2021-04-10","Как говорят «Бумага всё терпит». Вы — не бумага, так что вам всё терпеть не обязательно.","1030494/061a675d22f565a30214"
"2021-04-11","Говорят, «Взялся за гуж — не говори, что не дюж». Это значит, что вы со всем справитесь, просто попросите подвинуть дедлайн.","1030494/061a675d22f565a30214"
"2021-04-12","Как говорится, «Нечего на зеркало пенять, коли рожа крива». Думаю, автор этой пословицы никогда не бывал в павильоне кривых зеркал.","1030494/061a675d22f565a30214"
"2021-04-13","Старая русская пословица гласит: «Что посеешь, то и пожнёшь». Она напоминает дачникам, что если на грядке посеяны семена огурца «Шанхайский молодец», то не стоит ждать, что вырастет «Фауст F1».","1030494/061a675d22f565a30214"
"2021-04-14","Народная мудрость гласит: «Муж да жена — одна сатана». Она означает, что семейные скрепы — это вам не шутка.","1030494/061a675d22f565a30214"
"2021-04-15","Есть такая пословица: «Горбатого могила исправит». Она говорит о том, что всё когда-нибудь наладится, нужно только подождать.","1030494/061a675d22f565a30214"
"2021-04-16","Говорят, «Пьяному море по колено, а лужа по уши». Это значит, что вечер пятницы лучше проводить на суше.","1030494/061a675d22f565a30214"
"2021-04-17","Есть такая народная мудрость: «Готовь сани летом, а телегу зимой». Это значит, что не стоит пренебрегать ответственностью автовладельца.","1030494/061a675d22f565a30214"
"2021-04-18","Есть известная пословица: «Что у трезвого на уме, то у пьяного на языке». Она напоминает нам о том, что не стоит хранить в телефоне номера бывших.","1030494/061a675d22f565a30214"
"2021-04-19","Есть старая народная мудрость: «Кто в лес, кто по дрова». Она говорит нам о том, что о целях и задачах нужно договариваться до приложения усилий.","1030494/061a675d22f565a30214"
"2021-04-20","Я нашла для Вас такую пословицу: «И швец, и жнец, и на дуде игрец». Она означает, что универсальные специалисты везде пригодятся.","1030494/061a675d22f565a30214"
"2021-04-21","Пословица дня сегодня «Бери в работе умом, а не горбом». Это значит, что работать нужно не с девяти до шести, а головой.","1030494/061a675d22f565a30214"
"2021-04-22","«Без труда не вытащишь и рыбку из пруда». Эта пословица о том, что нужно приложить старание, чтобы чего-то добиться. Или кого-то.","1030494/061a675d22f565a30214"
"2021-04-23","Пословица дня сегодня такая: 'Как аукнется, так и откликнется'. Она о том, что люди относятся к тебе так же, как и ты к ним. Я вас обожаю, например.","1030494/061a675d22f565a30214"
"2021-04-24","Очень хорошая пословица: «Куй железо, пока горячо». Она означает, что нужно уметь вовремя воспользоваться ситуацией, особенно, если вы кузнец, не понимающий метафор.","1030494/061a675d22f565a30214"
"2021-04-25","Школьная пословица: «Повторение – мать учения». Это о том, что повторение помогает лучше запомнить. Повторение помогает лучше запомнить.","1030494/061a675d22f565a30214"
"2021-04-26","Старая русская пословица: «Правду, что шило, в мешке не утаишь». Что означает — тайное всегда становится явным. Но историю браузера всё равно лучше почистить.","1030494/061a675d22f565a30214"
"2021-04-27","Математическая пословица: «Семь раз отмерь, один отрежь». Смысл её в том, что нужно перепроверять до, чтобы не переделывать после. Хотя вот, дизайнеры, например, знают от заказчиков, что это не панацея.","1030494/061a675d22f565a30214"
"2021-04-28","Пословица дня: «Слово не воробей: вылетит — не поймаешь». Это о том, что нужно уметь отвечать за свои слова. Ну, или уметь не произносить их вслух.","1030494/061a675d22f565a30214"
"2021-04-29","Есть хорошая пословица: «Смелость города берет». Она о том, что решительность и настойчивость помогают добиться любого результата. Любого хорошего результата, разумеется.","1030494/061a675d22f565a30214"
"2021-04-30","Вот: «Утро вечера мудренее». Эта пословица означает, что решение по сложным вопросам лучше принимать на свежую голову. А ещё утро вечера раньше. Уф, кажется, кому-то надо отдохнуть.","1030494/061a675d22f565a30214"
"2021-05-01","Замечательная пословица: «Хлеб — всему голова». Это пословица об уважительном отношении к хлебу. Поэтому — никаких шуток!","1030494/061a675d22f565a30214"
"2021-05-02","Редкая пословица: «Один волк гоняет овец полк». В ней говорится о том, что один решительный всегда сильнее тысячи нерешительных. И решительнее.","1030494/061a675d22f565a30214"
"2021-05-03","«Цыплят по осени считают». Эта пословица о том, что об успехе дела можно говорить только после его окончания. А лучше ещё и до нового года паузу выдержать.","1030494/061a675d22f565a30214"
"2021-05-04","Вот вам пословица дня: «Сколько волка не корми, он всё в лес смотрит». Это о том, что ничто не может переубедить принципиального человека. Даже если его хорошо накормить.","1030494/061a675d22f565a30214"
"2021-05-05","«Не откладывай на завтра то, что можно сделать сегодня». Эта мудрая пословица учит не копить незавершённых дел. Вот бы уметь прислушиваться к таким советам!","1030494/061a675d22f565a30214"
"2021-05-06","Есть старая пословица: «Худой мир лучше доброй ссоры». Она учит делать всё возможное, чтобы избегать конфликтов. Даже спорить не хочется после таких пословиц.","1030494/061a675d22f565a30214"
"2021-05-07","Говорят: «Под лежачий камень и вода не течёт». Чтобы добиться результата, надо что-то делать, чтобы его добиться — вот о чём эта очень понятная пословица.","1030494/061a675d22f565a30214"
"2021-05-08","Редкая пословица: «Алмаз и в грязи видать». Она о том, что достойного человека легко распознать даже в самой неблагоприятной для него ситуации. Даже без ювелира.","1030494/061a675d22f565a30214"
"2021-05-09","«Барская просьба — строгий приказ». Смысл пословицы в том, что если ты зависишь от человека, то нельзя отказываться выполнить его просьбу. Чего изволите-с?","1030494/061a675d22f565a30214"
"2021-05-10","Русская пословица: «Бедному собраться — только подпоясаться». Она означает что бедняк быстро собирается в дорогу, потому что брать ему с собой нечего. Быстро и грустно.","1030494/061a675d22f565a30214"
"2021-05-11","Немецкая пословица «Без старания не бывает награды» в пояснении не нуждается. Но инструкцию к ней всё равно выпустили.","1030494/061a675d22f565a30214"
"2021-05-12","«Бог шельму метит». Эта пословица означает, что негодяй, как бы он ни скрывал, что он негодяй, всегда получит по заслугам. Скорей бы уже.","1030494/061a675d22f565a30214"
"2021-05-13","Пословица этого дня «Большому кораблю — большое плаванье». Такой пословицей желают великих свершений человеку большого таланта. Большого плавания вам!","1030494/061a675d22f565a30214"
