стоимость парома в хельсинки	search.market.how_much
стиральная машина сименс	search.market.commodity
аренда грузовика	search.market.service
айфон цена	search.market.how_much
лада приора универсал калужская область,Ищу ответ [ Открывается поиск по запросу <лада приора универсал калужская область> ],купить ладу приору универсал	search.market.commodity
алиса пятнадцатого сентября сколько стоит билет кыргызстан сургут,Сейчас найдём [ Открывается поиск по запросу <15 сентября сколько стоит билет кыргызстан сургут> ],алиса сколько стоит сургут ош билет	search.market.how_much
снять дом посуточно в хабаровске	search.market.service
плитка для ванны,Ищу ответ [ Открывается поиск по запросу <плитка для ванны> ],яркая плитка для ванны	search.market.commodity
замок зажигания на приору цена,Заглянула на Маркет. В среднем — 1352 рубля. Смотрите.,замок зажигания на приору цена в ульяновске	search.market.how_much
билет до калининграда	search.market.service
дешевый авиабилет из узбекистана	search.avia
сколько стоит билет на самолет с нижнего новгорода в турцию	search.avia
авиабилеты домодедово саратов	search.avia
авиабилеты москва кишинев	search.avia
ветряные генераторы продажа	search.market.commodity
как сделать так чтобы твоя продукция продавалась быстро,Открываю поиск [ Открывается поиск по запросу <как сделать так чтобы твоя продукция продавалась быстро> ],сумки из натурального меха	search.market.commodity
алиса меховые шапки из норки с ондатры с козырьком,Сейчас найдём [ Открывается поиск по запросу <меховые шапки из норки с ондатры с козырьком> ],алиса женские меховые шапки из норки с козырьком	search.market.commodity
алиса скажи пожалуйста сколько стоит билет до питера,Сейчас найдём [ Открывается поиск по запросу <сколько стоит билет до питера> ],алиса скажи сколько стоит машина до питера	search.market.how_much
купить стекло фары,Найдётся всё! [ Открывается поиск по запросу <купить стекло фары> ],купить стекло фары ваз двадцать один ноль пять город	search.market.commodity
свечи тержинан,Свечи Тержинан — это комбинированный препарат\, которому присущи антибактериальные\, бактерицидные и противогрибковые свойства,какая стоимость этих свечей в аптеке	search.market.how_much
погода,Сейчас в Санкт-Петербурге -5\, пасмурно.,журнальные столики спб бу	search.market.commodity
купить хонор семь а про в магазине ситилинк город псков	search.market.commodity
привет алиса,Привет-привет!,а сколько стоит покататься на речном трамвайчике в москве в новогодние праздники	search.market.how_much
алиса найди бэушный прицеп на машину	search.market.commodity
какова высота пирамиды хеопса,138 м,сколько стоит билет в египет	search.market.how_much
сигнализация старлайн с девяносто шесть цена	search.market.how_much
цепь,Найдётся всё! [ Открывается поиск по запросу <цепь> ],цепи на ходовую бобкэт	search.market.commodity
ниссан панфиндер бу от частных лиц,Открываю поиск [ Открывается поиск по запросу <ниссан панфиндер бу от частных лиц> ],ниссан патфайндер бу продажа машины с пробегом	search.market.commodity
алиса что делать на новый год,Вы по адресу — я приготовила кое-что особенное. Знаменитый режиссёр посоветует вам новогодние фильмы\, популярная певица поделится своей любимой музыкой\, а самый известный российский техноблогер поможет выбрать подарки. Осторожно — это затягивает.,слушай алиса сколько стоит бугатти вейрон	search.market.how_much
телевизоры работающие на процессоре мали четыреста пятьдесят,Найдётся всё! [ Открывается поиск по запросу <телевизоры работающие на процессоре мали 450> ],телевизор хайер тридцать два дюйма	search.market.commodity
да,Что да?,алиса а скажи мне дэдпул игрушки дэдпул	search.market.commodity
бензо бензо снегоуборщики хонда овские цена,Примерно 175050 рублей. Нашла на Маркете. Смотрите.,генератор хонда бензо	search.market.commodity
минск деал бай,Сейчас найду [ Открывается поиск по запросу <минск деал бай> ],портативные игровые консоли купить в минске	search.market.commodity
алиса купить свиней в ленинском районе,По адресу Волгоградская область\, Ленинский район ничего найти не удалось.,алиса купить маленьких поросят в ленинском районе	search.market.commodity
ситилинк пермь каталог,Одну секунду... [ Открывается поиск по запросу <ситилинк пермь каталог> ],компрессор вихрь двести тридцать	search.market.commodity
супракс цена,Открываю Яндекс,флуимуцил цена	search.market.how_much
але,Привет-привет!,найти чехлы на датсун он до	search.market.commodity
скажи название хамелеон хамелеон хамелеон резиновый,Ищу для вас ответ [ Открывается поиск по запросу <название хамелеон хамелеон хамелеон резиновый> ],игрушка хамелеон для маленьких детей резиновая	search.market.commodity
чем я могу помочь,Тут уже ничем не поможете,посмотри медицина я хочу купить тестомес в городе бухаре в узбекистане	search.market.commodity
алиса самые популярные видеорегистраторы,Сейчас найду [ Открывается поиск по запросу <самые популярные видеорегистраторы> ],алиса цены на видеорегистраторы мио в самаре	search.market.how_much
снятие поставить на фольксваген поло телевизор сколько стоит,Ищу для вас ответ [ Открывается поиск по запросу <снятие поставить на фольксваген поло телевизор сколько стоит> ],в автосалоне сколько стоит на фольксваген поло телевизор снято поставить	search.market.how_much
сколько стоят свечи клотримазол в нальчике,Даже не знаю. Спросим Яндекс?,самые дешевые свечи от молочницы при беременности	search.market.commodity
мониторы zo вилье	search.market.commodity
какое средство купить от заложенности носа,Открываю поиск [ Открывается поиск по запросу <какое средство купить от заложенности носа> ],називин от заложенности носа сколько стоит	search.market.how_much
оплатить пошлину на авто в ствол цена,Ищу в Яндексе [ Открывается поиск по запросу <оплатить пошлину на авто в ствол цена> ],оплатить пошлину на отцовство цена	search.market.how_much
гкф кнауф двенадцать с половиной миллиметров стоимость	search.market.how_much
диспорт,Давайте поищем [ Открывается поиск по запросу <диспорт> ],летняя обувь фирмы рикер	search.market.commodity
алис привет,Я здесь.,сколько будет мелирование стоить в городе сасово в парикмахерской	search.market.how_much
перепускной клапан кпп трактора т сто пятьдесят,Ищу для вас ответ [ Открывается поиск по запросу <перепускной клапан кпп трактора т 150> ],перепускной клапан кпп трактора т сто пятьдесят	search.market.commodity
сколько стоит сварочный аппарат ресанта,Посмотрела на Маркете. Это стоит около 8090 рублей. Вот.,сколько стоит сварочный аппарат ресанта сто девяносто ампер	search.market.how_much
купить радиостанцию автомобильную,Сейчас найду [ Открывается поиск по запросу <купить радиостанцию автомобильную> ],продать радиостанцию автомобильную	search.market.commodity
ремонт слуховых аппаратов в электростали	search.market.service
шоу теней сколько стоит билет	search.market.how_much
какая цена на киндер домик,Заглянула на Маркет. В среднем — 886 рублей. Смотрите.,новогодний киндер домик	search.market.commodity
что за костюм у альпинистов,Давайте поищем [ Открывается поиск по запросу <что за костюм у альпинистов> ],стоимость альпинистского зимнего костюма	search.market.how_much
разборка газель,Показываю варианты.,запчасти газель бэушный	search.market.commodity
существуют ли какие либо простейшие сотовые телефоны для очень пожилых людей чтобы было как можно меньше кнопок,Одну секунду... [ Открывается поиск по запросу <существуют ли какие либо простейшие сотовые телефоны для очень пожилых людей чтобы было как можно меньше кнопок> ],кнопочный телефон для пожилых людей девяносто плюс	search.market.commodity
пара отпариватель филипс,Ищу для вас ответ [ Открывается поиск по запросу <пара отпариватель филипс> ],парогенератор филипс	search.market.commodity
купить недорого,Ищу ответ [ Открывается поиск по запросу <купить недорого> ],купить недорого пряжу	search.market.commodity
вентилируемый фасад с плиткой,Ищу для вас ответ [ Открывается поиск по запросу <вентилируемый фасад с плиткой> ],фасад плитка шестьдесят на шестьдесят керамогранит	search.market.commodity
уровень tu номер двадцать пять,Ищу ответ [ Открывается поиск по запросу <уровень tu номер 25> ],курантил номер двадцать пять	search.market.commodity
купить хонду сирви,Ищу ответ [ Открывается поиск по запросу <купить хонду сирви> ],купить тойота рав четыре в спб механика	search.market.commodity
фары на лансер восемьдесят девятый год,Сейчас найдём [ Открывается поиск по запросу <фары на лансер 89 год> ],фара на лансер восемьдесят девятый девяностый год	search.market.commodity
найди алиса ксяоми редми,Ищу ответ [ Открывается поиск по запросу <ксяоми редми> ],найди xiaomi redmi макс	search.market.commodity
электромобиль в рязани,Ищу для вас ответ [ Открывается поиск по запросу <электромобиль в рязани> ],машина на электричестве купить	search.market.commodity
сколько стоит попугай жако в городе ростовской области	search.market.how_much
алиса найди мне пожалуйста брендовые часы тиссот мужские в красноярске показать фотографии,Ищу ответ [ Открывается поиск по запросу <брендовые часы тиссот мужские в красноярске показать фотографии> ],алиса покажи пожалуйста мужские туфли дерби и оксфорды багира ванные в красноярске цены	search.market.how_much
сколько стоит купить енота в красноярске,Посмотрела на Маркете. Это стоит около 805 рублей. Вот.,сколько стоит купить живого енота в красноярске	search.market.how_much
какое лекарственное средство дороже новокаин или лидокаин,Открываю поиск [ Открывается поиск по запросу <какое лекарственное средство дороже новокаин или лидокаин> ],сколько в среднем стоит лидокаин	search.market.how_much
купить линзы циклон,Сейчас найду [ Открывается поиск по запросу <купить линзы циклон> ],линзы в фары под цоколь аш семь	search.market.commodity
аппарат,Открываю поиск [ Открывается поиск по запросу <аппарат> ],аппарат a m n p ноль два солнышко	search.market.commodity
что делаешь,Новости тут почитала. Если коротко\, то мир меняется\, стабильности нет.,где можно купить z ахиллеса опять в россии	search.market.commodity
машина лексус триста бушные в бишкеке,Одну секунду... [ Открывается поиск по запросу <машина лексус 300 бушные в бишкеке> ],лексус триста бэушная город бишкек	search.market.commodity
недвижимость новочебоксарск до миллиона,Ищу в Яндексе [ Открывается поиск по запросу <недвижимость новочебоксарск до 1000000> ],вторичное жилье новочебоксарск до миллиона	search.market.commodity
айпад три цена,Заглянула на Маркет. В среднем — 36900 рублей. Смотрите.,айпад три вай фай цена	search.market.how_much
гидроподвески,Ищу в Яндексе [ Открывается поиск по запросу <гидроподвески> ],гидроподвески на гипсокартон	search.market.commodity
алиса светодиодные фонари на грузовые прицепы во владивостоке продажа,Открываю поиск [ Открывается поиск по запросу <светодиодные фонари на грузовые прицепы во владивостоке продажа> ],светодиодные прожекторы	search.market.commodity
ну сегодня пойду,Давайте\, давайте\, жду,снять студию яблоновский от пяти тысяч по гагарина	search.market.service
купить керамическую плитку,Ищу для вас ответ [ Открывается поиск по запросу <купить керамическую плитку> ],купить керамическую плитку для ванны белорусских производителей	search.market.commodity
алиса пакажи пажлста чихол на самсунг 7ес,Сейчас найдём [ Открывается поиск по запросу <пжлста чехол на самсунг 7 ес> ],алиса найди пожалуйста чехлы на заказ женская	search.market.commodity
купить билет на цирк корона,Найдётся всё! [ Открывается поиск по запросу <купить билет на цирк корона> ],купить билет на цирк дюсолей	search.market.commodity
сколько стоит эта денежка сторублевая сочи с пластиком внутри,Ищу для вас ответ [ Открывается поиск по запросу <сколько стоит эта денежка сторублевая сочи с пластиком внутри> ],два рубля с гагариным сколько стоит	search.market.how_much
алиса купить тюнингованный бампер на хендай элантра две тысячи шестого года,Одну секунду... [ Открывается поиск по запросу <купить тюнингованный бампер на хендай элантра 2006 года> ],алиса купить тюнингованный бампер на хендай элантра	search.market.commodity
косметика кларенс,Ищу ответ [ Открывается поиск по запросу <косметика кларенс> ],крема la conte	search.market.commodity
флуконазол в белоруссии,Сейчас найдём [ Открывается поиск по запросу <флуконазол в белоруссии> ],экзодерил в белоруссии	search.market.commodity
ваз двадцать один десять,Сейчас найду [ Открывается поиск по запросу <ваз 21 10> ],мерс двести двадцать три д коврики	search.market.commodity
мед в сотах,Пчелиные соты наполнены медом\, прополисом\, воском\, пергой\, пыльцой\, поэтому польза пчелиных сот – факт неоспоримый. Каждый из этих компонентов сам по себе – ценная кладовая. Сочетание же их – невероятно целебный коктейль. Воск включает в себя 300 составляющих\, а в сотах нектар надолго сохраняет свои благоприятные свойства и богатый состав из витаминов\, минералов\, ферментов.,стоимость меда в мини сотах	search.market.how_much
фольксваген универсал цена	search.market.how_much
привет,Я здесь.,в рудном где можно купить биби восемь робота	search.market.commodity
цены на датсун он до две тысячи восемнадцатого года,Ищу в Яндексе [ Открывается поиск по запросу <цены на датсун он до 2018 года> ],цены на датсун он в ставрополе в ключавто две тысячи восемнадцатого года	search.market.how_much
шторы москва люкс	search.market.commodity
хочу в тайланд не хватает денег что делать,Давайте поищем [ Открывается поиск по запросу <хочу в тайланд не хватает денег что делать> ],горящие туры в пхукет тайланд из санкт петербурга	search.market.service
чем отличается проигрыватель виниловых пластинок пионер pl x пятьсот от пионер pl x тысяча,Сейчас найдём [ Открывается поиск по запросу <чем отличается проигрыватель виниловых пластинок пионер pl x 500 от пионер pl x 1000> ],купить	search.market.commodity
прайс лист эльдорадо набережные челны,Найдётся всё! [ Открывается поиск по запросу <прайс лист эльдорадо набережные челны> ],новейшие микроволновые печи самсунг	search.market.commodity
последние модели опель,Сейчас найдём [ Открывается поиск по запросу <последние модели опель> ],модельный ряд две тысячи пятнадцатый две тысячи шестнадцатый год	search.market.commodity
алиса найди мне кардио,Найдётся всё! [ Открывается поиск по запросу <кардио> ],алиса найди мне кардио тренажер	search.market.commodity
почему когда скинешь гигабайты пишет недоступно серверу,Открываю поиск [ Открывается поиск по запросу <почему когда скинешь гигабайты пишет недоступно серверу> ],самый дешевый пакет интернета на теле два	search.market.service
фирма ивацевичи древ смотреть,Открываю поиск [ Открывается поиск по запросу <фирма ивацевичи древ смотреть> ],ами мебель столы школьные	search.market.commodity
сколько стоит сальник сальник на задний коренной двигателя три ст,Заглянула на Маркет. В среднем — 330 рублей. Смотрите.,а привод на вентилятор	search.market.how_much
флю,Ищу для вас ответ [ Открывается поиск по запросу <флю> ],таблетки от гриппа тамифлю	search.market.commodity
ванны с бишофитом,Открываю поиск [ Открывается поиск по запросу <ванны с бишофитом> ],нафталановые ванны	search.market.commodity
цена стульчик для ванны,Заглянула на Маркет. В среднем — 3400 рублей. Смотрите.,цена сидения для ванны	search.market.how_much
отель во владивостоке,По адресу Владивосток\, Жариковская улица 19 есть \"Буссе\". Работает круглосуточно.,номер на двоих в гостинице владивостока	search.market.service
